{
  "schema_version": 1,
  "run_identity": {
    "schema_version": 1,
    "run_ordinal": 1,
    "profile": "B3a",
    "uuid": "550e8400-e29b-41d4-a716-446655440000"
  },
  "outcome_code": "success",
  "wallclock_sha256": "abcdef1234567890abcdef1234567890abcdef1234567890abcdef1234567890",
  "raw_artifacts": {
    "stdout_sha256":  "abcdef1234567890abcdef1234567890abcdef1234567890abcdef1234567890",
    "stderr_sha256":  "abcdef1234567890abcdef1234567890abcdef1234567890abcdef1234567890",
    "wal_raw_sha256": "abcdef1234567890abcdef1234567890abcdef1234567890abcdef1234567890"
  },
  "completion_proof_sha256": "abcdef1234567890abcdef1234567890abcdef1234567890abcdef1234567890",
  "outputs_audit_sha256":    "abcdef1234567890abcdef1234567890abcdef1234567890abcdef1234567890",
  "classifier_reason": "success"
}